{
  "format_version": 1,
  "name": "Chi Rho Studio Catalog Subscription",
  "updated": "2026-10-28T12:27:27-05:00",
  "catalogs": [
    {
      "id": "languages",
      "name": "Application Languages",
      "type": "languages",
      "path": "languages.json",
      "version": 6,
      "updated": "2026-10-01T22:47:20-05:00",
      "file_size": 715,
      "sha256": "c9d607948bfd1e58b1d57a16846652d71fa0fb44ca6c25ecdefa6c55adcb136c"
    },
    {
      "id": "bibles",
      "name": "Bible Translations",
      "type": "bibles",
      "path": "bible-catalog.json",
      "version": 7,
      "updated": "2026-10-28T12:27:27-05:00",
      "file_size": 37872,
      "sha256": "8f5b13ff95bde9530e048922c77dae4e5fd0c94a661aa96b2d9f1b7f90920e48"
    },
    {
      "id": "hymns",
      "name": "Hymns",
      "type": "hymns",
      "path": "hymns-catalog.json",
      "version": 0,
      "updated": ""
    }
  ]
}
